### ISSUE TITLE
BIGIP flannel_vxlan FDB and pod ARP not populated

### ISSUE THREAD

**Issue by vincentmli** [F5Networks/k8s-bigip-ctlr#558]
#### Description
this is maybe configuration  I am missing, after following http://clouddocs.f5.com/containers/v2/kubernetes/kctlr-use-bigip-k8s.html#bigip-k8s-setup and applied the k8s-bigip-ctrl deployment, created two busybox pod on node, but there is no any FDB entry in flannel_vxlan or arp entries in BIGIP

#### Kubernetes Version
<Version of Kubernetes being used>

[root@centos-k8s-master kubernetes]# cluster/kubectl.sh version
Client Version: version.Info{Major:"1", Minor:"10+", GitVersion:"v1.10.0-alpha.3.14+bdde1961911138-dirty", GitCommit:"bdde1961911138c81ea2ffafb8859cf992d49917", GitTreeState:"dirty", BuildDate:"2018-02-02T22:02:34Z", GoVersion:"go1.9.3", Compiler:"gc", Platform:"linux/amd64"}
Server Version: version.Info{Major:"1", Minor:"10+", GitVersion:"v1.10.0-alpha.3.14+bdde1961911138-dirty", GitCommit:"bdde1961911138c81ea2ffafb8859cf992d49917", GitTreeState:"dirty", BuildDate:"2018-02-02T22:02:34Z", GoVersion:"go1.9.3", Compiler:"gc", Platform:"linux/amd64"}

#### Controller Version
<Version of k8s-bigip-ctlr being used>
k8s-bigip-ctrl 1.4.0

#### BIG-IP Version
<Version of BIG-IP being used>
12.1.2 hf2

#### Diagnostic Information

BIGIP 

 # tmsh list net fdb
<pre>
net fdb tunnel flannel_vxlan { }
net fdb tunnel http-tunnel { }
net fdb tunnel socks-tunnel { }
net fdb vlan vli-169 { }
</pre>
# tmsh list net self
<pre>
net self 10.169.72.34 {
    address 10.169.72.34/16
    allow-service all
    traffic-group traffic-group-local-only
    vlan vli-169
}
net self 10.244.30.15/16 {
    address 10.244.30.15/16
    allow-service all
    traffic-group traffic-group-local-only
    vlan flannel_vxlan
}
</pre>
 # tmsh list net tunnels vxlan fl-vxlan
<pre>
net tunnels vxlan fl-vxlan {
    app-service none
    flooding-type none
    port otv
}
</pre>
# tmsh list net tunnels tunnel flannel_vxlan
<pre>
net tunnels tunnel flannel_vxlan {
    if-index 128
    key 1
    local-address 10.169.72.34
    profile fl-vxlan
}
</pre>

K8S node

the fake bigip node, note  BIGIP self ip 10.169.72.34 as flannel.alpha.coreos.com/public-ip

<pre>
apiVersion: v1
kind: Node
metadata:
  name: bigip
  annotations:
    # This is the MAC address of the VXLAN tunnel you have created on the
    # BIG-IP device
    flannel.alpha.coreos.com/backend-data: '{"VtepMAC":"00:50:56:a0:7d:d8"}'
    flannel.alpha.coreos.com/backend-type: "vxlan"
    flannel.alpha.coreos.com/kube-subnet-manager: "true"
    # This address is the BIG-IP VTEP (internal address) in the Flannel VXLAN
    flannel.alpha.coreos.com/public-ip: 10.169.72.34
spec:
  # This defines the Flannel subnet for the BIG-IP device. Be sure this subnet
  # does not collide with the subnets of the other Nodes. The BIG-IP device's
  # self-ip address will be defined in this subnet.
  podCIDR: 10.244.30.0/24
</pre>

BIGIP ip link list to show VtepMAC matches flannel_vxlan MAC

<pre>
7: flannel_vxlan: <POINTOPOINT,MULTICAST,NOARP,UP,LOWER_UP> mtu 1500 qdisc noqueue state UNKNOWN
    link/ether 00:50:56:a0:7d:d8 peer 00:00:00:00:00:00

</pre>
# cluster/kubectl.sh describe node bigip
<pre>
Name:               bigip
Roles:              <none>
Labels:             <none>
Annotations:        flannel.alpha.coreos.com/backend-data={"VtepMAC":"00:50:56:a0:7d:d8"}
                    flannel.alpha.coreos.com/backend-type=vxlan
                    flannel.alpha.coreos.com/kube-subnet-manager=true
                    flannel.alpha.coreos.com/public-ip=10.169.72.34
                    node.alpha.kubernetes.io/ttl=0
Taints:             <none>
CreationTimestamp:  Fri, 09 Feb 2018 10:26:43 -0800
Conditions:
  Type             Status    LastHeartbeatTime                 LastTransitionTime                Reason                   Message
  ----             ------    -----------------                 ------------------                ------                   -------
  Ready            Unknown   Fri, 09 Feb 2018 10:26:43 -0800   Fri, 09 Feb 2018 10:27:44 -0800   NodeStatusNeverUpdated   Kubelet never posted node status.
  MemoryPressure   Unknown   Fri, 09 Feb 2018 10:26:43 -0800   Fri, 09 Feb 2018 10:27:44 -0800   NodeStatusNeverUpdated   Kubelet never posted node status.
  DiskPressure     Unknown   Fri, 09 Feb 2018 10:26:43 -0800   Fri, 09 Feb 2018 10:27:44 -0800   NodeStatusNeverUpdated   Kubelet never posted node status.
Addresses:
System Info:
 Machine ID:
 System UUID:
 Boot ID:
 Kernel Version:
 OS Image:
 Operating System:
 Architecture:
 Container Runtime Version:
 Kubelet Version:
 Kube-Proxy Version:
PodCIDR:                     10.244.30.0/24
ExternalID:                  bigip
Non-terminated Pods:         (0 in total)
  Namespace                  Name    CPU Requests  CPU Limits  Memory Requests  Memory Limits
  ---------                  ----    ------------  ----------  ---------------  -------------
Allocated resources:
  (Total limits may be over 100 percent, i.e., overcommitted.)
  CPU Requests               CPU Limits                 Memory Requests            Memory Limits
  ------------               ----------                 ---------------            -------------
  0 (-9223372036854775808%)  0 (-9223372036854775808%)  0 (-9223372036854775808%)  0 (-9223372036854775808%)
Events:                      <none>
</pre>

node 10.169.72.93 ip addr show 
<pre>
5: flannel.1: <BROADCAST,MULTICAST,UP,LOWER_UP> mtu 1450 qdisc noqueue state UNKNOWN
    link/ether b2:34:20:11:27:6b brd ff:ff:ff:ff:ff:ff
    inet 10.244.0.0/32 scope global flannel.1
       valid_lft forever preferred_lft forever
    inet6 fe80::b034:20ff:fe11:276b/64 scope link
       valid_lft forever preferred_lft forever
6: cni0: <BROADCAST,MULTICAST,UP,LOWER_UP> mtu 1450 qdisc noqueue state UP qlen 1000
    link/ether 4e:80:bb:9a:7e:4f brd ff:ff:ff:ff:ff:ff
    inet 10.244.0.1/24 scope global cni0
       valid_lft forever preferred_lft forever
    inet6 fe80::4c80:bbff:fe9a:7e4f/64 scope link
       valid_lft forever preferred_lft forever
</pre>
# cluster/kubectl.sh describe node 10.169.72.93
<pre>

Name:               10.169.72.93
Roles:              <none>
Labels:             beta.kubernetes.io/arch=amd64
                    beta.kubernetes.io/os=linux
                    kubernetes.io/hostname=10.169.72.93
Annotations:        flannel.alpha.coreos.com/backend-data={"VtepMAC":"b2:34:20:11:27:6b"}
                    flannel.alpha.coreos.com/backend-type=vxlan
                    flannel.alpha.coreos.com/kube-subnet-manager=true
                    flannel.alpha.coreos.com/public-ip=10.169.72.93
                    node.alpha.kubernetes.io/ttl=0
                    volumes.kubernetes.io/controller-managed-attach-detach=true
                    volumes.kubernetes.io/keep-terminated-pod-volumes=true
Taints:             <none>
CreationTimestamp:  Fri, 09 Feb 2018 10:19:46 -0800
Conditions:
  Type             Status  LastHeartbeatTime                 LastTransitionTime                Reason                       Message
  ----             ------  -----------------                 ------------------                ------                       -------
  OutOfDisk        False   Fri, 09 Feb 2018 13:36:24 -0800   Fri, 09 Feb 2018 10:19:46 -0800   KubeletHasSufficientDisk     kubelet has sufficient disk space available
  MemoryPressure   False   Fri, 09 Feb 2018 13:36:24 -0800   Fri, 09 Feb 2018 10:19:46 -0800   KubeletHasSufficientMemory   kubelet has sufficient memory available
  DiskPressure     False   Fri, 09 Feb 2018 13:36:24 -0800   Fri, 09 Feb 2018 10:19:46 -0800   KubeletHasNoDiskPressure     kubelet has no disk pressure
  Ready            True    Fri, 09 Feb 2018 13:36:24 -0800   Fri, 09 Feb 2018 10:19:56 -0800   KubeletReady                 kubelet is posting ready status
Addresses:
  InternalIP:  10.169.72.93
  Hostname:    10.169.72.93
Capacity:
 cpu:            4
 hugepages-2Mi:  0
 memory:         3882052Ki
 pods:           110
Allocatable:
 cpu:            4
 hugepages-2Mi:  0
 memory:         3779652Ki
 pods:           110
System Info:
 Machine ID:                 4c195d2cc9bd441d8fd1cd7c4cfdf659
 System UUID:                4206EF49-4134-6579-4811-4B52DFD7151E
 Boot ID:                    38fbe8cc-e82f-404e-8aac-4b7a6c50053f
 Kernel Version:             3.10.0-514.el7.x86_64
 OS Image:                   CentOS Linux 7 (Core)
 Operating System:           linux
 Architecture:               amd64
 Container Runtime Version:  docker://1.12.6
 Kubelet Version:            v1.10.0-alpha.3.14+bdde1961911138-dirty
 Kube-Proxy Version:         v1.10.0-alpha.3.14+bdde1961911138-dirty
PodCIDR:                     10.244.0.0/24
ExternalID:                  10.169.72.93
Non-terminated Pods:         (5 in total)
  Namespace                  Name                                        CPU Requests  CPU Limits  Memory Requests  Memory Limits
  ---------                  ----                                        ------------  ----------  ---------------  -------------
  default                    busybox-5phd6                               0 (0%)        0 (0%)      0 (0%)           0 (0%)
  default                    busybox-bj69v                               0 (0%)        0 (0%)      0 (0%)           0 (0%)
  kube-system                kube-dns-754f9cd4f5-942hq                   260m (6%)     0 (0%)      110Mi (2%)       170Mi (4%)
  kube-system                kube-flannel-ds-njhws                       100m (2%)     100m (2%)   50Mi (1%)        50Mi (1%)
  kube-system                test-bigip-controller-1-56497f7f55-5dxcw    100m (2%)     100m (2%)   128M (3%)        128M (3%)
Allocated resources:
  (Total limits may be over 100 percent, i.e., overcommitted.)
  CPU Requests  CPU Limits  Memory Requests  Memory Limits
  ------------  ----------  ---------------  -------------
  460m (11%)    200m (5%)   288840Ki (7%)    350280Ki (9%)
Events:         <none>
</pre>

# cluster/kubectl.sh get po -o wide
<pre>
NAME            READY     STATUS    RESTARTS   AGE       IP            NODE
busybox-5phd6   1/1       Running   3          3h        10.244.0.27   10.169.72.93
busybox-bj69v   1/1       Running   3          3h        10.244.0.26   10.169.72.93
</pre>

# cluster/kubectl.sh get po -o wide --namespace=kube-system
<pre>
NAME                                       READY     STATUS    RESTARTS   AGE       IP             NODE
kube-dns-754f9cd4f5-942hq                  3/3       Running   0          3h        10.244.0.23    10.169.72.93
kube-flannel-ds-njhws                      1/1       Running   0          3h        10.169.72.93   10.169.72.93
test-bigip-controller-1-56497f7f55-5dxcw   1/1       Running   0          1h        10.244.0.28    10.169.72.93
</pre>

Kube-flannel manifest
<pre>
---
kind: ClusterRole
apiVersion: rbac.authorization.k8s.io/v1beta1
metadata:
  name: flannel
rules:
  - apiGroups:
      - ""
    resources:
      - pods
    verbs:
      - get
  - apiGroups:
      - ""
    resources:
      - nodes
    verbs:
      - list
      - watch
  - apiGroups:
      - ""
    resources:
      - nodes/status
    verbs:
      - patch
---
kind: ClusterRoleBinding
apiVersion: rbac.authorization.k8s.io/v1beta1
metadata:
  name: flannel
roleRef:
  apiGroup: rbac.authorization.k8s.io
  kind: ClusterRole
  name: flannel
subjects:
- kind: ServiceAccount
  name: flannel
  namespace: kube-system
---
apiVersion: v1
kind: ServiceAccount
metadata:
  name: flannel
  namespace: kube-system
---
kind: ConfigMap
apiVersion: v1
metadata:
  name: kube-flannel-cfg
  namespace: kube-system
  labels:
    tier: node
    app: flannel
data:
  cni-conf.json: |
    {
      "name": "cbr0",
      "plugins": [
        {
          "type": "flannel",
          "delegate": {
            "hairpinMode": true,
            "isDefaultGateway": true
          }
        },
        {
          "type": "portmap",
          "capabilities": {
            "portMappings": true
          }
        }
      ]
    }
  net-conf.json: |
    {
      "Network": "10.244.0.0/16",
      "Backend": {
        "Type": "vxlan"
      }
    }
---
apiVersion: extensions/v1beta1
kind: DaemonSet
metadata:
  name: kube-flannel-ds
  namespace: kube-system
  labels:
    tier: node
    app: flannel
spec:
  template:
    metadata:
      labels:
        tier: node
        app: flannel
    spec:
      hostNetwork: true
      nodeSelector:
        beta.kubernetes.io/arch: amd64
      tolerations:
      - key: node-role.kubernetes.io/master
        operator: Exists
        effect: NoSchedule
      serviceAccountName: flannel
      initContainers:
      - name: install-cni
        image: quay.io/coreos/flannel:v0.10.0-amd64
        command:
        - cp
        args:
        - -f
        - /etc/kube-flannel/cni-conf.json
        - /etc/cni/net.d/10-flannel.conflist
        volumeMounts:
        - name: cni
          mountPath: /etc/cni/net.d
        - name: flannel-cfg
          mountPath: /etc/kube-flannel/
      containers:
      - name: kube-flannel
        image: quay.io/coreos/flannel:v0.10.0-amd64
        command:
        - /opt/bin/flanneld
        args:
        - --iface=ens224
        - --ip-masq
        - --kube-subnet-mgr
        resources:
          requests:
            cpu: "100m"
            memory: "50Mi"
          limits:
            cpu: "100m"
            memory: "50Mi"
        securityContext:
          privileged: true
        env:
        - name: POD_NAME
          valueFrom:
            fieldRef:
              fieldPath: metadata.name
        - name: POD_NAMESPACE
          valueFrom:
            fieldRef:
              fieldPath: metadata.namespace
        volumeMounts:
        - name: run
          mountPath: /run
        - name: flannel-cfg
          mountPath: /etc/kube-flannel/
      volumes:
        - name: run
          hostPath:
            path: /run
        - name: cni
          hostPath:
            path: /etc/cni/net.d
        - name: flannel-cfg
          configMap:
            name: kube-flannel-cfg
</pre>

f5-k8s-bigip-ctrl-cluster yaml
<pre>

apiVersion: extensions/v1beta1
kind: Deployment
metadata:
  annotations:
    deployment.kubernetes.io/revision: "1"
  labels:
    app: test-bigip-controller-1
  name: test-bigip-controller-1
  namespace: kube-system
spec:
  replicas: 1
  selector:
    matchLabels:
      app: test-bigip-controller-1
  strategy:
    rollingUpdate:
      maxSurge: 1
      maxUnavailable: 1
    type: RollingUpdate
  template:
    metadata:
      labels:
        app: test-bigip-controller-1
    spec:
      serviceAccountName: bigip-ctlr-serviceaccount
      containers:
      - args:
        - --bigip-partition
        - test
        - --bigip-url
        - 10.169.72.34
        - --bigip-username
        - admin
        - --bigip-password
        - admin
        - --verify-interval
        - "30"
        - --namespace
        - default
        - --node-poll-interval
        - "1"
        - --pool-member-type
        - cluster
        - --log-level
        - INFO
        command:
        - /app/bin/k8s-bigip-ctlr
        image: f5networks/k8s-bigip-ctlr:1.4.0
        imagePullPolicy: Always
        name: test-bigip-controller-1
        resources:
          limits:
            cpu: 100m
            memory: 128M
      schedulerName: default-scheduler
      terminationGracePeriodSeconds: 30

---

apiVersion: v1
kind: ServiceAccount
metadata:
  name: bigip-ctlr-serviceaccount
  namespace: kube-system

---

# for use in k8s clusters using RBAC
kind: ClusterRole
apiVersion: rbac.authorization.k8s.io/v1beta1
metadata:
  name: bigip-ctlr-clusterrole
rules:
- apiGroups:
  - ""
  - "extensions"
  resources:
  - nodes
  - services
  - endpoints
  - namespaces
  - ingresses
  - secrets
  verbs:
  - get
  - list
  - watch
- apiGroups:
  - ""
  - "extensions"
  resources:
  - configmaps
  - events
  - ingresses/status
  verbs:
  - get
  - list
  - watch
  - update
  - create
  - patch

---

kind: ClusterRoleBinding
apiVersion: rbac.authorization.k8s.io/v1beta1
metadata:
  name: bigip-ctlr-clusterrole-binding
  namespace: kube-system
roleRef:
  apiGroup: rbac.authorization.k8s.io
  kind: ClusterRole
  name: bigip-ctlr-clusterrole
subjects:
- kind: ServiceAccount
  name: bigip-ctlr-serviceaccount
  namespace: kube-system

</pre>

busy box
<pre>
apiVersion: v1
kind: ReplicationController
metadata:
  name: busybox
spec:
  replicas: 2
  selector:
    app: busybox
  template:
    metadata:
      name: busybox
      labels:
        app: busybox
    spec:
      containers:
      - image: busybox
        command:
          - sleep
          - "3600"
        imagePullPolicy: IfNotPresent
        name: busybox
      restartPolicy: Always

</pre>

ping from busybox pod to BIGIP flannel_vxlan self ip

# cluster/kubectl.sh exec -it busybox-5phd6 -- /bin/sh
<pre>
/ # ping 10.244.30.15
PING 10.244.30.15 (10.244.30.15): 56 data bytes

14:01:14.542188 IP 10.169.72.93.42771 > 10.169.72.34.8472: UDP, length 106 in slot1/tmm1 lis=_wcard_tunnel_/Common/flannel_vxlan
14:01:15.542469 IP 10.169.72.93.42771 > 10.169.72.34.8472: UDP, length 106 in slot1/tmm1 lis=_wcard_tunnel_/Common/flannel_vxlan
14:01:16.542550 IP 10.169.72.93.42771 > 10.169.72.34.8472: UDP, length 106 in slot1/tmm1 lis=_wcard_tunnel_/Common/flannel_vxlan
</pre>

**Comment by vincentmli** [comment]
that resolved the fdb problem, also thanks to point out the arp entry only get created on BIGIP when actual virtual server/pools in configmap deployed on BIGIP
